<?xml version="1.0" encoding="UTF-8"?>

<root xmlns:xsi="http://www.w3.org/2001/XMLSchema-instance"
      xsi:schemaLocation="urn:my_namespace note.xsd"
      xmlns="urn:my_namespace">

    <SomeTreeNode myname="A" mycounter="1" myflag="true" myslidervalue="0.56">
        <child1>
            <RequiredInnerNode myname="B" mycounter="2" myslidervalue="0.7878" myflag="true">
                <child2>
                    <SomeTreeNode myname="C" mycounter="3" myflag="false" myslidervalue="0.9128"/>
                </child2>
                <safe_child>
                    <SomeTreeNode myname="D" mycounter="4" myflag="false" myslidervalue="2983748325.352352">

                    </SomeTreeNode>
                </safe_child>
            </RequiredInnerNode>
        </child1>
    </SomeTreeNode>
</root>